sp_notation,pref_label,wkt,type_notation,type_label,status_label
SW-50331270,HARTSFOOT CLOSE STW FINAL EFFLUENT MELCOMBE BINGHAM,POINT(376300 102700) <http://www.opengis.net/def/crs/EPSG/0/27700>,UA,SEWAGE DISCHARGES - FINAL/TREATED EFFLUENT - NOT WATER COMPANY,OPEN
SW-50410119,PUDDLETOWN STW FE,POINT(375100 94950) <http://www.opengis.net/def/crs/EPSG/0/27700>,SA,SEWAGE DISCHARGES - FINAL/TREATED EFFLUENT - WATER COMPANY,OPEN
SW-50410150,PIDDLEHINTON STW FE,POINT(372165 96316) <http://www.opengis.net/def/crs/EPSG/0/27700>,SA,SEWAGE DISCHARGES - FINAL/TREATED EFFLUENT - WATER COMPANY,OPEN
SW-50410164,RIVER PIDDLE AT PIDDLEHINTON,POINT(371500 97200) <http://www.opengis.net/def/crs/EPSG/0/27700>,F6,FRESHWATER - RIVERS,OPEN
SW-50419999,MISCELLANEOUS UPPER PIDDLE CATCHMENT,POINT(370000 102400) <http://www.opengis.net/def/crs/EPSG/0/27700>,PE,POLLUTION/INVESTIGATION POINTS - ENVIRONMENT,OPEN
SW-5041GW03,CARTER BARN FARM BOREHOLE,POINT(373250 97950) <http://www.opengis.net/def/crs/EPSG/0/27700>,BA,GROUNDWATER - BOREHOLE,OPEN
SW-50429999,MISCELLANEOUS DEVILS BROOK CATCHMENT,POINT(377000 99980) <http://www.opengis.net/def/crs/EPSG/0/27700>,PE,POLLUTION/INVESTIGATION POINTS - ENVIRONMENT,OPEN
SW-50430109,PIDDLE UPSTREAM CHAMBERLAYNES FARM,POINT(384473 92745) <http://www.opengis.net/def/crs/EPSG/0/27700>,F6,FRESHWATER - RIVERS,OPEN
SW-50430126,BROCKHILL WATERCRESS FARM B & C 2,POINT(383740 92930) <http://www.opengis.net/def/crs/EPSG/0/27700>,AD,AGRICULTURE - WATER CRESS FARMING,OPEN
SW-50430127,BROCKHILL WATERCRESS FARM B & C 1,POINT(383700 92950) <http://www.opengis.net/def/crs/EPSG/0/27700>,AD,AGRICULTURE - WATER CRESS FARMING,OPEN
SW-50430144,RIVER PIDDLE AT TURNERSPUDDLE,POINT(382964 93274) <http://www.opengis.net/def/crs/EPSG/0/27700>,F6,FRESHWATER - RIVERS,OPEN
SW-50439999,MISCELLANEOUS MIDDLE PIDDLE CATCHMENT DEVILS BROOK TO BERE STREAM,POINT(381500 93000) <http://www.opengis.net/def/crs/EPSG/0/27700>,PE,POLLUTION/INVESTIGATION POINTS - ENVIRONMENT,OPEN
SW-5043GW06,BROCKHILL CRESS BEDS POINT D,POINT(383425 92835) <http://www.opengis.net/def/crs/EPSG/0/27700>,BA,GROUNDWATER - BOREHOLE,OPEN
SW-50440001,MILBORNE ST ANDREW EFFLUENT TO LAGOON,POINT(380300 96650) <http://www.opengis.net/def/crs/EPSG/0/27700>,SA,SEWAGE DISCHARGES - FINAL/TREATED EFFLUENT - WATER COMPANY,OPEN
SW-50440119,BERE STREAM D/S DODDINGS WATERCRESS AT   SNATFORD BRIDGE,POINT(385580 92986) <http://www.opengis.net/def/crs/EPSG/0/27700>,F6,FRESHWATER - RIVERS,OPEN
SW-50440122,DODDINGS FARM WATERCRESS SETTLEMENT POND A1,POINT(385320 93150) <http://www.opengis.net/def/crs/EPSG/0/27700>,AD,AGRICULTURE - WATER CRESS FARMING,OPEN
SW-50440126,DODDINGS FARM WATERCRESS A1  BERE REGIS,POINT(385130 93960) <http://www.opengis.net/def/crs/EPSG/0/27700>,AD,AGRICULTURE - WATER CRESS FARMING,OPEN
SW-50440129,DODDINGS FARM WATERCRESS B2 BERE REGIS,POINT(385180 93800) <http://www.opengis.net/def/crs/EPSG/0/27700>,AD,AGRICULTURE - WATER CRESS FARMING,OPEN
SW-50440130,BERE STREAM D/S SOUTHBROOK CRESS SETTLEMENT,POINT(385144 93819) <http://www.opengis.net/def/crs/EPSG/0/27700>,F6,FRESHWATER - RIVERS,OPEN
SW-50440146,SOUTHBROOK CRESS OUTLET FROM BEDS 2 TO 4 BERE REGIS,POINT(384750 94670) <http://www.opengis.net/def/crs/EPSG/0/27700>,AD,AGRICULTURE - WATER CRESS FARMING,OPEN
SW-50440149,SOUTHBROOK CRESS OUTLET FROM BEDS 5 TO 10 BERE REGIS,POINT(384830 94450) <http://www.opengis.net/def/crs/EPSG/0/27700>,AD,AGRICULTURE - WATER CRESS FARMING,OPEN
SW-50440153,SOUTHBROOK CRESS OUTLET FROM BED 1 BERE REGIS,POINT(384710 94610) <http://www.opengis.net/def/crs/EPSG/0/27700>,AD,AGRICULTURE - WATER CRESS FARMING,OPEN
SW-50440158,BERE STREAM AT BERE REGIS,POINT(384209 94994) <http://www.opengis.net/def/crs/EPSG/0/27700>,F6,FRESHWATER - RIVERS,OPEN
SW-50440166,ROKE CRESS SETTLEMENT HOLLYBUSH FARM BERE REGIS,POINT(383870 95630) <http://www.opengis.net/def/crs/EPSG/0/27700>,AD,AGRICULTURE - WATER CRESS FARMING,OPEN
SW-50440168,ROKE CRESS SOUTH HOLLYBUSH BERE REGIS,POINT(383850 95650) <http://www.opengis.net/def/crs/EPSG/0/27700>,AD,AGRICULTURE - WATER CRESS FARMING,OPEN
SW-50440170,ROKE CRESS NORTH HOLLYBUSH BERE REGIS,POINT(383720 95770) <http://www.opengis.net/def/crs/EPSG/0/27700>,AD,AGRICULTURE - WATER CRESS FARMING,OPEN
SW-50440180,MILBORNE ST ANDREW WTW,POINT(380325 98271) <http://www.opengis.net/def/crs/EPSG/0/27700>,TA,TRADE DISCHARGES - PROCESS EFFLUENT - WATER COMPANY (WTW),OPEN
SW-50440194,MILBORNE ST ANDREW STW FE BERE STREAM,POINT(380340 96690) <http://www.opengis.net/def/crs/EPSG/0/27700>,SA,SEWAGE DISCHARGES - FINAL/TREATED EFFLUENT - WATER COMPANY,OPEN
SW-50440197,MILBORNE ST ANDREW STORM OVERFLOW TO BERE STREAM,POINT(380300 96400) <http://www.opengis.net/def/crs/EPSG/0/27700>,SB,SEWAGE DISCHARGES - STW STORM OVERFLOW/STORM TANK - WATER COMPANY,OPEN
SW-50449999,MISCELLANEOUS BERE CATCHMENT,POINT(380850 97500) <http://www.opengis.net/def/crs/EPSG/0/27700>,PE,POLLUTION/INVESTIGATION POINTS - ENVIRONMENT,OPEN
SW-5044GW01,DODDINGS WATERCRESS-PREVIOUS MONITORING ON SITE C3566000,POINT(385210 93480) <http://www.opengis.net/def/crs/EPSG/0/27700>,BA,GROUNDWATER - BOREHOLE,OPEN
SW-5044GW02,ROKE WATERCRESS BEDS-PREVIOUS MONITORING ON SITE C3567000,POINT(383550 95830) <http://www.opengis.net/def/crs/EPSG/0/27700>,BA,GROUNDWATER - BOREHOLE,OPEN
SW-50450110,WAREHAM STW,POINT(393580 88700) <http://www.opengis.net/def/crs/EPSG/0/27700>,SA,SEWAGE DISCHARGES - FINAL/TREATED EFFLUENT - WATER COMPANY,OPEN
SW-50450129,RIVER PIDDLE AT WEST MILLS WAREHAM,POINT(391328 87622) <http://www.opengis.net/def/crs/EPSG/0/27700>,F6,FRESHWATER - RIVERS,OPEN
SW-50450145,EIGHT HATCH FISH FARM EMERGENCY OUTLET,POINT(389390 88160) <http://www.opengis.net/def/crs/EPSG/0/27700>,AF,AGRICULTURE - FISH FARMING - NOT WATER COMPANY,OPEN
SW-50450146,OUTLET FROM EIGHT HATCH FISH FARM  TRIGON  WAREHAM,POINT(389350 88150) <http://www.opengis.net/def/crs/EPSG/0/27700>,AF,AGRICULTURE - FISH FARMING - NOT WATER COMPANY,OPEN
SW-50450150,EIGHT HATCH FISH FARM INLET,POINT(389484 88176) <http://www.opengis.net/def/crs/EPSG/0/27700>,FC,FRESHWATER - COMPARATIVE INLET POINTS,OPEN
SW-50450165,PURBECK FISHERIES EARTHPONDS 2,POINT(388420 88520) <http://www.opengis.net/def/crs/EPSG/0/27700>,AF,AGRICULTURE - FISH FARMING - NOT WATER COMPANY,OPEN
SW-50450167,PURBECK FISHERIES RACEWAY 1,POINT(388420 88560) <http://www.opengis.net/def/crs/EPSG/0/27700>,AF,AGRICULTURE - FISH FARMING - NOT WATER COMPANY,OPEN
SW-50450172,RIVER PIDDLE U/S PURBECK FISH FARM,POINT(388300 88600) <http://www.opengis.net/def/crs/EPSG/0/27700>,FC,FRESHWATER - COMPARATIVE INLET POINTS,OPEN
SW-50450320,WAREHAM FOREST STREAM AT SANDFORD ROAD,POINT(392460 88955) <http://www.opengis.net/def/crs/EPSG/0/27700>,F6,FRESHWATER - RIVERS,OPEN
SW-50459901,WAREHAM STW STORM SEWAGE,POINT(393640 88630) <http://www.opengis.net/def/crs/EPSG/0/27700>,SB,SEWAGE DISCHARGES - STW STORM OVERFLOW/STORM TANK - WATER COMPANY,OPEN
SW-50459999,MISCELLANEOUS LOWER PIDDLE CATCHMENT BERE STREAM TO WAREHAM,POINT(388500 90500) <http://www.opengis.net/def/crs/EPSG/0/27700>,PE,POLLUTION/INVESTIGATION POINTS - ENVIRONMENT,OPEN
SW-50510190,EVERSHOT STW FE,POINT(357810 104370) <http://www.opengis.net/def/crs/EPSG/0/27700>,SA,SEWAGE DISCHARGES - FINAL/TREATED EFFLUENT - WATER COMPANY,OPEN
SW-50510192,EVERSHOT STW STORM OVERFLOW TO   RIVER FROME,POINT(357800 104380) <http://www.opengis.net/def/crs/EPSG/0/27700>,SB,SEWAGE DISCHARGES - STW STORM OVERFLOW/STORM TANK - WATER COMPANY,OPEN
SW-50520131,TOLLER PORCORUM STW  MAIDEN NEWTON,POINT(356620 98020) <http://www.opengis.net/def/crs/EPSG/0/27700>,SA,SEWAGE DISCHARGES - FINAL/TREATED EFFLUENT - WATER COMPANY,OPEN
SW-50520233,HOOKE SPRINGS FISH FARM OUTLET BEAMINSTER,POINT(353500 100300) <http://www.opengis.net/def/crs/EPSG/0/27700>,AF,AGRICULTURE - FISH FARMING - NOT WATER COMPANY,OPEN
SW-50520237,HOOKE SPRINGS FISH FARM INLET (PARK POND SPUR),POINT(353433 100696) <http://www.opengis.net/def/crs/EPSG/0/27700>,FC,FRESHWATER - COMPARATIVE INLET POINTS,OPEN
SW-50530138,RIVER FROME AT NOTTON,POINT(360931 95991) <http://www.opengis.net/def/crs/EPSG/0/27700>,F6,FRESHWATER - RIVERS,OPEN
SW-50530190,MAIDEN NEWTON STW  DORCHESTER,POINT(360450 97250) <http://www.opengis.net/def/crs/EPSG/0/27700>,SA,SEWAGE DISCHARGES - FINAL/TREATED EFFLUENT - WATER COMPANY,OPEN
SW-50530197,RIVER FROME AT MAIDEN NEWTON,POINT(359561 97689) <http://www.opengis.net/def/crs/EPSG/0/27700>,F6,FRESHWATER - RIVERS,OPEN
SW-50539999,MISC UPPER DORSET FROME CATCHMENT HOOKE TO SYDLING WATER,POINT(366000 96500) <http://www.opengis.net/def/crs/EPSG/0/27700>,PE,POLLUTION/INVESTIGATION POINTS - ENVIRONMENT,OPEN
SW-50540127,SYDLING WATER D/S LOWER MAGISTON FISH FARM,POINT(363610 95728) <http://www.opengis.net/def/crs/EPSG/0/27700>,F6,FRESHWATER - RIVERS,OPEN
SW-50540137,LOWER MAGISTON WATERCRESS FARM C,POINT(363530 96080) <http://www.opengis.net/def/crs/EPSG/0/27700>,AD,AGRICULTURE - WATER CRESS FARMING,OPEN
SW-50540139,LOWER MAGISTON WATERCRESS FARM B,POINT(363560 96200) <http://www.opengis.net/def/crs/EPSG/0/27700>,AD,AGRICULTURE - WATER CRESS FARMING,OPEN
SW-50540170,SYDLING WATER U/S HUISH TROUT FARM,POINT(363296 98900) <http://www.opengis.net/def/crs/EPSG/0/27700>,FC,FRESHWATER - COMPARATIVE INLET POINTS,OPEN
SW-50540184,SYDLING ST NICHOLAS STORM OVERFLOW,POINT(363130 98680) <http://www.opengis.net/def/crs/EPSG/0/27700>,SB,SEWAGE DISCHARGES - STW STORM OVERFLOW/STORM TANK - WATER COMPANY,OPEN
SW-50540186,SYDLING ST NICHOLAS STW FE,POINT(363040 98800) <http://www.opengis.net/def/crs/EPSG/0/27700>,SA,SEWAGE DISCHARGES - FINAL/TREATED EFFLUENT - WATER COMPANY,OPEN
SW-5054GW01,LOWER MAGISTON WATERCRESS BEDS-PREVIOUS MONITORING ON SITE C3609000,POINT(363542 96388) <http://www.opengis.net/def/crs/EPSG/0/27700>,BA,GROUNDWATER - BOREHOLE,OPEN
SW-50550130,RIVER FROME AT BOCKHAMPTON,POINT(372117 90461) <http://www.opengis.net/def/crs/EPSG/0/27700>,F6,FRESHWATER - RIVERS,OPEN
SW-50550158,RIVER FROME AT BRADFORD PEVERELL,POINT(365941 93133) <http://www.opengis.net/def/crs/EPSG/0/27700>,F6,FRESHWATER - RIVERS,OPEN
SW-50550310,RIVER CERNE AT CHARMINSTER,POINT(367955 92667) <http://www.opengis.net/def/crs/EPSG/0/27700>,F6,FRESHWATER - RIVERS,OPEN
SW-50550330,GODMANSTONE STW,POINT(366590 96450) <http://www.opengis.net/def/crs/EPSG/0/27700>,SA,SEWAGE DISCHARGES - FINAL/TREATED EFFLUENT - WATER COMPANY,OPEN
SW-50550362,RIVER CERNE AT NETHER CERNE,POINT(366906 98381) <http://www.opengis.net/def/crs/EPSG/0/27700>,F6,FRESHWATER - RIVERS,OPEN
SW-50550374,CERNE ABBAS STW FE,POINT(366570 99960) <http://www.opengis.net/def/crs/EPSG/0/27700>,SA,SEWAGE DISCHARGES - FINAL/TREATED EFFLUENT - WATER COMPANY,OPEN
SW-5055GW01,DORSET COUNTY HOSPITAL GROUNDWATER,POINT(368440 90490) <http://www.opengis.net/def/crs/EPSG/0/27700>,BA,GROUNDWATER - BOREHOLE,OPEN
SW-5055GW07,MOUNT PLEASANT FARM BOREHOLE CERNE ABBAS,POINT(365781 101028) <http://www.opengis.net/def/crs/EPSG/0/27700>,BA,GROUNDWATER - BOREHOLE,OPEN
SW-5055GW08,"HONEY PITTS PLANTATION (SPRING), MINTERNE PARK",POINT(366550 103840) <http://www.opengis.net/def/crs/EPSG/0/27700>,BB,GROUNDWATER - SPRING,OPEN
SW-50569999,MISCELLANEOUS SOUTH WINTERBOURNE CATCHMENT,POINT(366000 89950) <http://www.opengis.net/def/crs/EPSG/0/27700>,PE,POLLUTION/INVESTIGATION POINTS - ENVIRONMENT,OPEN
SW-5056GW05,CAME DOWN GOLF CLUB BOREHOLE,POINT(369068 87097) <http://www.opengis.net/def/crs/EPSG/0/27700>,BA,GROUNDWATER - BOREHOLE,OPEN
SW-5056GW07,CHURCH FARM BOREHOLE,POINT(364370 89300) <http://www.opengis.net/def/crs/EPSG/0/27700>,BA,GROUNDWATER - BOREHOLE,OPEN
SW-50570001,WOODSFORD QUARRY,POINT(375202 89895) <http://www.opengis.net/def/crs/EPSG/0/27700>,TG,TRADE DISCHARGES - MINERAL WORKINGS,OPEN
SW-50570145,RIVER FROME DS WADDOCK CROSS,POINT(380739 89686) <http://www.opengis.net/def/crs/EPSG/0/27700>,F6,FRESHWATER - RIVERS,OPEN
SW-50570150,WADDOCK CROSS WATERCRESS SETTLEMENT LAGOON,POINT(379730 90780) <http://www.opengis.net/def/crs/EPSG/0/27700>,AD,AGRICULTURE - WATER CRESS FARMING,OPEN
SW-50570152,WADDOCK CROSS WATERCRESS A1,POINT(379530 90900) <http://www.opengis.net/def/crs/EPSG/0/27700>,AD,AGRICULTURE - WATER CRESS FARMING,OPEN
SW-50570155,WADDOCK CROSS WATERCRESS B2,POINT(379610 90850) <http://www.opengis.net/def/crs/EPSG/0/27700>,AD,AGRICULTURE - WATER CRESS FARMING,OPEN
SW-50570160,WADDOCK CROSS WATERCRESS C3,POINT(379730 90790) <http://www.opengis.net/def/crs/EPSG/0/27700>,AD,AGRICULTURE - WATER CRESS FARMING,OPEN
SW-50570219,TRIB OF FROME DS WOODSFORD QUARRY,POINT(375083 90056) <http://www.opengis.net/def/crs/EPSG/0/27700>,F6,FRESHWATER - RIVERS,OPEN
SW-50570220,ILSINGTON CRESS SETTLEMENT OUTLET,POINT(375600 91620) <http://www.opengis.net/def/crs/EPSG/0/27700>,AD,AGRICULTURE - WATER CRESS FARMING,OPEN
SW-50570225,TRIB OF FROME DS ILSINGTON CRESS BEDS,POINT(376667 91472) <http://www.opengis.net/def/crs/EPSG/0/27700>,F6,FRESHWATER - RIVERS,OPEN
SW-50570239,DORCHESTER (LOUDS MILL) STW,POINT(370930 90240) <http://www.opengis.net/def/crs/EPSG/0/27700>,SA,SEWAGE DISCHARGES - FINAL/TREATED EFFLUENT - WATER COMPANY,OPEN
SW-50570246,DORCHESTER STW STORM OVERFLOW NO 1,POINT(370930 90250) <http://www.opengis.net/def/crs/EPSG/0/27700>,SB,SEWAGE DISCHARGES - STW STORM OVERFLOW/STORM TANK - WATER COMPANY,CLOSED
SW-50570251,RIVER FROME U/S DORCHESTER STW LOUDS MILL,POINT(370509 90393) <http://www.opengis.net/def/crs/EPSG/0/27700>,F6,FRESHWATER - RIVERS,OPEN
SW-50570384,TINCLETON BROOK DS TINCLETON CRESS BEDS,POINT(376834 91678) <http://www.opengis.net/def/crs/EPSG/0/27700>,F6,FRESHWATER - RIVERS,OPEN
SW-50570386,TINCLETON EAST WATERCRESS BEDS 2,POINT(376730 91680) <http://www.opengis.net/def/crs/EPSG/0/27700>,AD,AGRICULTURE - WATER CRESS FARMING,OPEN
SW-50570388,TINCLETON WEST WATERCRESS BEDS 2,POINT(376620 91680) <http://www.opengis.net/def/crs/EPSG/0/27700>,AD,AGRICULTURE - WATER CRESS FARMING,OPEN
SW-50570390,TINCLETON EAST WATERCRESS BEDS 1,POINT(376670 91720) <http://www.opengis.net/def/crs/EPSG/0/27700>,AD,AGRICULTURE - WATER CRESS FARMING,OPEN
SW-50570392,TINCLETON WEST WATERCRESS BEDS 1,POINT(376650 91700) <http://www.opengis.net/def/crs/EPSG/0/27700>,AD,AGRICULTURE - WATER CRESS FARMING,OPEN
SW-50579999,MISC MIDDLE FROME CATCHMENT SOUTH WINTERBOURNE TO TADNOLL BROOK,POINT(377000 91000) <http://www.opengis.net/def/crs/EPSG/0/27700>,PE,POLLUTION/INVESTIGATION POINTS - ENVIRONMENT,OPEN
SW-5057GW01,"HURST FARM, MORETON BOREHOLE",POINT(379190 89990) <http://www.opengis.net/def/crs/EPSG/0/27700>,BA,GROUNDWATER - BOREHOLE,OPEN
SW-50580145,TADNOLL BROOK AT MILL HOUSE NURSERY,POINT(377499 87150) <http://www.opengis.net/def/crs/EPSG/0/27700>,F6,FRESHWATER - RIVERS,OPEN
SW-50580170,WARMWELL WATERCRESS FARM A (PREVIOUSLY SETTLEMENT OUTLET 043241),POINT(375150 87310) <http://www.opengis.net/def/crs/EPSG/0/27700>,AD,AGRICULTURE - WATER CRESS FARMING,OPEN
SW-50580183,TADNOLL BROOK DOWNSTREAM BROADMAYNE STW,POINT(373560 86716) <http://www.opengis.net/def/crs/EPSG/0/27700>,F6,FRESHWATER - RIVERS,OPEN
SW-50580185,BROADMAYNE STW  DORCHESTER,POINT(373450 86690) <http://www.opengis.net/def/crs/EPSG/0/27700>,SA,SEWAGE DISCHARGES - FINAL/TREATED EFFLUENT - WATER COMPANY,OPEN
SW-50580187,BROADMAYNE STW STORM OVERFLOW,POINT(373390 86800) <http://www.opengis.net/def/crs/EPSG/0/27700>,SB,SEWAGE DISCHARGES - STW STORM OVERFLOW/STORM TANK - WATER COMPANY,OPEN
SW-50589999,MISCELLANEOUS TADNOLL BROOK CATCHMENT,POINT(375500 86000) <http://www.opengis.net/def/crs/EPSG/0/27700>,PE,POLLUTION/INVESTIGATION POINTS - ENVIRONMENT,OPEN
SW-5058GW01,WARMWELL WATERCRESS BEDS-PREVIOUS MONITORING ON SITE C3414000,POINT(374664 87458) <http://www.opengis.net/def/crs/EPSG/0/27700>,BA,GROUNDWATER - BOREHOLE,OPEN
SW-50590008,DOREYS BALL CLAY WORKS EFFLUENT,POINT(391370 84538) <http://www.opengis.net/def/crs/EPSG/0/27700>,TG,TRADE DISCHARGES - MINERAL WORKINGS,OPEN
SW-50590127,RIVER FROME AT HOLME BRIDGE,POINT(389053 86656) <http://www.opengis.net/def/crs/EPSG/0/27700>,F6,FRESHWATER - RIVERS,OPEN
SW-50590144,EAST STOKE FINAL  WAREHAM,POINT(387770 86980) <http://www.opengis.net/def/crs/EPSG/0/27700>,SA,SEWAGE DISCHARGES - FINAL/TREATED EFFLUENT - WATER COMPANY,OPEN
SW-50590188,RIVER FROME AT WOOL BRIDGE,POINT(384459 87163) <http://www.opengis.net/def/crs/EPSG/0/27700>,F6,FRESHWATER - RIVERS,OPEN
SW-50590203,RIVER FROME U/S LYTCHETT CONFLUENCE,POINT(384043 87284) <http://www.opengis.net/def/crs/EPSG/0/27700>,F6,FRESHWATER - RIVERS,OPEN
SW-50590229,WOOL STW FE,POINT(382240 87370) <http://www.opengis.net/def/crs/EPSG/0/27700>,SA,SEWAGE DISCHARGES - FINAL/TREATED EFFLUENT - WATER COMPANY,OPEN
SW-50590907,RIVER WIN AT SEVEN STARS,POINT(382911 86911) <http://www.opengis.net/def/crs/EPSG/0/27700>,F6,FRESHWATER - RIVERS,OPEN
SW-50599999,MISCELLANEOUS LOWER FROME TADNOLL BROOK TO WAREHAM,POINT(388500 90500) <http://www.opengis.net/def/crs/EPSG/0/27700>,PE,POLLUTION/INVESTIGATION POINTS - ENVIRONMENT,OPEN
SW-50900130,CORFE CASTLE STW SETTLED STORM SEWAGE,POINT(396179 83128) <http://www.opengis.net/def/crs/EPSG/0/27700>,SB,SEWAGE DISCHARGES - STW STORM OVERFLOW/STORM TANK - WATER COMPANY,OPEN
SW-50900712,CORFE RIVER D/S CORFE STW,POINT(396710 84140) <http://www.opengis.net/def/crs/EPSG/0/27700>,F6,FRESHWATER - RIVERS,OPEN
SW-50900722,CORFE CASTLE STW,POINT(396140 83130) <http://www.opengis.net/def/crs/EPSG/0/27700>,SA,SEWAGE DISCHARGES - FINAL/TREATED EFFLUENT - WATER COMPANY,OPEN
SW-50900956,HARMANS CROSS SEWAGE TREATMENT WORKS  SWANAGE,POINT(397500 80700) <http://www.opengis.net/def/crs/EPSG/0/27700>,SA,SEWAGE DISCHARGES - FINAL/TREATED EFFLUENT - WATER COMPANY,OPEN
SW-50908888,MISCELLANEOUS RIVER CORFE,POINT(396100 83000) <http://www.opengis.net/def/crs/EPSG/0/27700>,PE,POLLUTION/INVESTIGATION POINTS - ENVIRONMENT,OPEN
SW-50909999,MISC POOLE HARBOUR SOUTH CATCHMENT,POINT(397000 84000) <http://www.opengis.net/def/crs/EPSG/0/27700>,PE,POLLUTION/INVESTIGATION POINTS - ENVIRONMENT,OPEN
SW-50950147,BROWNSEA ISLAND SEWAGE TREATMENT WORKS (NATIONAL TRUST),POINT(402650 87750) <http://www.opengis.net/def/crs/EPSG/0/27700>,YZ,SEWAGE & TRADE COMBINED - UNSPECIFIED,OPEN
SW-50950270,POOLE HARBOUR AT LAKE (19400),POINT(398313 90468) <http://www.opengis.net/def/crs/EPSG/0/27700>,CA,SALINE WATER - DESIGNATED BATHING BEACHES,OPEN
SW-50950300,POOLE HARBOUR ROCKLEY SANDS (19450),POINT(397263 91078) <http://www.opengis.net/def/crs/EPSG/0/27700>,CA,SALINE WATER - DESIGNATED BATHING BEACHES,OPEN
SW-50950351,LYTCHETT MINSTER STW  POOLE,POINT(396780 92360) <http://www.opengis.net/def/crs/EPSG/0/27700>,SA,SEWAGE DISCHARGES - FINAL/TREATED EFFLUENT - WATER COMPANY,OPEN
SW-50950709,POOLE STW FE OUTFALLS 1 AND 2 COMBINED,POINT(400720 93580) <http://www.opengis.net/def/crs/EPSG/0/27700>,SA,SEWAGE DISCHARGES - FINAL/TREATED EFFLUENT - WATER COMPANY,OPEN
SW-50951010,SHERFORD RIVER AT KING BRIDGE,POINT(395449 92386) <http://www.opengis.net/def/crs/EPSG/0/27700>,F6,FRESHWATER - RIVERS,OPEN
SW-50951080,BLACKHEATH STW  BLOXWORTH  WAREHAM,POINT(389770 93260) <http://www.opengis.net/def/crs/EPSG/0/27700>,SA,SEWAGE DISCHARGES - FINAL/TREATED EFFLUENT - WATER COMPANY,OPEN
SW-50951082,BLACKHEATH STORM OVERFLOW,POINT(389780 93270) <http://www.opengis.net/def/crs/EPSG/0/27700>,SB,SEWAGE DISCHARGES - STW STORM OVERFLOW/STORM TANK - WATER COMPANY,OPEN
SW-50951085,SHERFORD AT SNAILS BRIDGE US BLACKHEATH,POINT(389960 93366) <http://www.opengis.net/def/crs/EPSG/0/27700>,F6,FRESHWATER - RIVERS,OPEN
SW-50958888,MISCELLANEOUS RIVER SHERFORD,POINT(394000 92100) <http://www.opengis.net/def/crs/EPSG/0/27700>,PE,POLLUTION/INVESTIGATION POINTS - ENVIRONMENT,OPEN
SW-50959901,LYTCHETT STW STORM SEWAGE,POINT(396850 92300) <http://www.opengis.net/def/crs/EPSG/0/27700>,SB,SEWAGE DISCHARGES - STW STORM OVERFLOW/STORM TANK - WATER COMPANY,OPEN
SW-50959999,MISC POOLE HARBOUR NORTH CATCHMENT INCLUDING HOLES BAY AND TRIBUTARIES,POINT(397000 92500) <http://www.opengis.net/def/crs/EPSG/0/27700>,PE,POLLUTION/INVESTIGATION POINTS - ENVIRONMENT,OPEN
SW-6WXE0529,MAIDEN NEWTON STW (AMP6 UNIQUE ID: 6WX13192S),POINT(360450 97250) <http://www.opengis.net/def/crs/EPSG/0/27700>,SB,SEWAGE DISCHARGES - STW STORM OVERFLOW/STORM TANK - WATER COMPANY,OPEN
SW-C0538000,HOOKE MAIDEN NEWTON,POINT(359533 97673) <http://www.opengis.net/def/crs/EPSG/0/27700>,F6,FRESHWATER - RIVERS,OPEN
SW-C0844000,WATERGATES FISH FARM,POINT(374160 87090) <http://www.opengis.net/def/crs/EPSG/0/27700>,AC,AGRICULTURE - FISH FARMING - WATER COMPANY,OPEN
SW-C4005700,POOLE STW STORM CHAMBER (COMBINED E+W),POINT(400700 93570) <http://www.opengis.net/def/crs/EPSG/0/27700>,SB,SEWAGE DISCHARGES - STW STORM OVERFLOW/STORM TANK - WATER COMPANY,OPEN
SW-C7010000,SOUTHBROOK CRESS SETTLEMENT BERE REGIS,POINT(385080 94000) <http://www.opengis.net/def/crs/EPSG/0/27700>,AD,AGRICULTURE - WATER CRESS FARMING,OPEN
SW-C7018000,"WARMWELL WATERCRESS FARM C (PREVIOUSLY WATERCRESS A, 043238)",POINT(374730 87330) <http://www.opengis.net/def/crs/EPSG/0/27700>,AD,AGRICULTURE - WATER CRESS FARMING,OPEN
SW-C7019001,WARMWELL WATERCRESS FARM D,POINT(374930 87270) <http://www.opengis.net/def/crs/EPSG/0/27700>,AD,AGRICULTURE - WATER CRESS FARMING,OPEN
SW-C7021001,WARMWELL WATERCRESS FARM B,POINT(374620 87390) <http://www.opengis.net/def/crs/EPSG/0/27700>,AD,AGRICULTURE - WATER CRESS FARMING,OPEN
SW-C7022000,BROCKHILL WATERCRESS FARM A RELEASE 1,POINT(383540 92880) <http://www.opengis.net/def/crs/EPSG/0/27700>,AD,AGRICULTURE - WATER CRESS FARMING,OPEN
SW-C7022001,BROCKHILL WATERCRESS FARM A RELEASE 2,POINT(383430 92870) <http://www.opengis.net/def/crs/EPSG/0/27700>,AD,AGRICULTURE - WATER CRESS FARMING,OPEN
SW-GWECO142,MARLEY BOTTOM BH GW WQ,POINT(380817 83742) <http://www.opengis.net/def/crs/EPSG/0/27700>,BA,GROUNDWATER - BOREHOLE,OPEN
SW-GWECO143,REW CORNER BH GW WQ,POINT(363785 89426) <http://www.opengis.net/def/crs/EPSG/0/27700>,BA,GROUNDWATER - BOREHOLE,OPEN
SW-GWECO145,THROOP BH GW WQ,POINT(382574 93276) <http://www.opengis.net/def/crs/EPSG/0/27700>,BA,GROUNDWATER - BOREHOLE,OPEN
SW-GWW18D01,STUDLAND AND GODLINGSTON HEATHS (SSSI) - SG1 (NCEA) GWDTE,POINT(401922 82732) <http://www.opengis.net/def/crs/EPSG/0/27700>,BA,GROUNDWATER - BOREHOLE,OPEN
SW-GWW18D02,STUDLAND AND GODLINGSTON HEATHS (SSSI) - SG2 (NCEA) GWDTE,POINT(401834 82667) <http://www.opengis.net/def/crs/EPSG/0/27700>,BA,GROUNDWATER - BOREHOLE,OPEN
SW-GWW18D08,STUDLAND AND GODLINGSTON HEATHS (SSSI) - SG8 (NCEA) GWDTE,POINT(402277 83965) <http://www.opengis.net/def/crs/EPSG/0/27700>,BA,GROUNDWATER - BOREHOLE,OPEN
SW-GWW18S12,STUDLAND AND GODLINGSTON HEATHS (SSSI) - SGSB1 (NCEA) GWDTE,POINT(401706 83507) <http://www.opengis.net/def/crs/EPSG/0/27700>,BA,GROUNDWATER - BOREHOLE,OPEN
SW-LSN0030,HAM COMMON POND,POINT(398334 90608) <http://www.opengis.net/def/crs/EPSG/0/27700>,FA,FRESHWATER - LAKES/PONDS/RESERVOIRS,OPEN
SW-LSN366,LSN0366 HATCH POND,POINT(401304 93865) <http://www.opengis.net/def/crs/EPSG/0/27700>,FA,FRESHWATER - LAKES/PONDS/RESERVOIRS,OPEN
SW-PLHABOUT,POOLE HARBOUR OUTER,POINT(400898 91056) <http://www.opengis.net/def/crs/EPSG/0/27700>,CE,SALINE WATER - ESTUARINE SITES - NON BATHING/SHELLFISH,OPEN
SW-RSN0029,RSN0029 AT FROME VAUGHCHURCH HOUSE,POINT(359978 97360) <http://www.opengis.net/def/crs/EPSG/0/27700>,F6,FRESHWATER - RIVERS,OPEN
SW-RSN0285,RSN0285 WRAXALL BROOK UPSTREAM OF BENVILLE BRIDGE,POINT(354855 104039) <http://www.opengis.net/def/crs/EPSG/0/27700>,F6,FRESHWATER - RIVERS,OPEN
SW-RSN0397,RSN0397 RIVER WIN AT RED LION,POINT(380493 85336) <http://www.opengis.net/def/crs/EPSG/0/27700>,F6,FRESHWATER - RIVERS,OPEN
SW-RSN0621,RSN0621 PIDDLE AT HYDE ESTATE,POINT(387537 89614) <http://www.opengis.net/def/crs/EPSG/0/27700>,F6,FRESHWATER - RIVERS,OPEN
SW-RSN0653,RSN0653 BERE STREAM D/S DODDINGS CRESS BEDS,POINT(385541 93090) <http://www.opengis.net/def/crs/EPSG/0/27700>,F6,FRESHWATER - RIVERS,OPEN
SW-RSN0845,RSN0845 CHANNEL AT THE DAIRY HOUSE WEST STAFFORD,POINT(373008 89799) <http://www.opengis.net/def/crs/EPSG/0/27700>,F6,FRESHWATER - RIVERS,OPEN
SW-RSN1197,RSN1197 RIVER HOOKE D/S BRIDGE FARM,POINT(353813 100005) <http://www.opengis.net/def/crs/EPSG/0/27700>,F6,FRESHWATER - RIVERS,OPEN
SW-RSN1389,RSN1389 MILL HOUSE,POINT(377872 99327) <http://www.opengis.net/def/crs/EPSG/0/27700>,F6,FRESHWATER - RIVERS,OPEN
SW-RSN1685,RSN1685 SYDLING DOWNSTREAM OFLOWER MAGISTON FARM,POINT(363568 95960) <http://www.opengis.net/def/crs/EPSG/0/27700>,F6,FRESHWATER - RIVERS,OPEN
SW-RSN1925,RSN1925 DRAIN AT BOVINGTON MOD TRAINING AREA,POINT(382386 87912) <http://www.opengis.net/def/crs/EPSG/0/27700>,F6,FRESHWATER - RIVERS,OPEN
SW-RSN2045,RSN2045 U/S A352 ROAD BRIDGE (98**),POINT(372088 89383) <http://www.opengis.net/def/crs/EPSG/0/27700>,F6,FRESHWATER - RIVERS,OPEN
SW-RSN2213,RSN2213 CHARMINSTER (90**),POINT(367963 92705) <http://www.opengis.net/def/crs/EPSG/0/27700>,F6,FRESHWATER - RIVERS,OPEN
SW-RTN0044,CERNE AT KETTLE BRIDGE,POINT(366410 101463) <http://www.opengis.net/def/crs/EPSG/0/27700>,F6,FRESHWATER - RIVERS,OPEN
SW-RTN0045,FROME AT MAIDEN NEWTON GAUGING STATION,POINT(359648 97644) <http://www.opengis.net/def/crs/EPSG/0/27700>,F6,FRESHWATER - RIVERS,OPEN
SW-SSN0512,NORTHPORT @ NORTHMOOR PARK,POINT(391838 88661) <http://www.opengis.net/def/crs/EPSG/0/27700>,F6,FRESHWATER - RIVERS,OPEN
SW-SSN1532,SSN1532 MOREDON PARK COTTAGE,POINT(391129 93463) <http://www.opengis.net/def/crs/EPSG/0/27700>,F6,FRESHWATER - RIVERS,OPEN
SW-SSN1536,SSN1536 WARMWELL HEATH,POINT(375147 87199) <http://www.opengis.net/def/crs/EPSG/0/27700>,F6,FRESHWATER - RIVERS,OPEN
SW-SSN1808,SSN1808 BERE STREAM U/S MILTON ABBAS LAKE,POINT(378738 102332) <http://www.opengis.net/def/crs/EPSG/0/27700>,F6,FRESHWATER - RIVERS,OPEN
